"AI-optimized data Lakes for Real-Time Big Data Management and Autonomous Query Optimization","G. Ramesh; N. V. Sivareddy; L. H. Jasim; P. Murugeswari; B. Kumaraswamy; M. L","Department of CSE, Gokaraju Rangaraju Institute of Engineering and Technology, Hyderabad, Telangana, India; Department of Computer Science and Engineering, CMR Institute of Technology, Hyderabad; Department of Computers Techniques Engineering, College of Technical Engineering, The Islamic University, Najaf, Iraq, Al Diwaniyah, Iraq; Department of Electrical Communication Engineering, Sethu Institute of Technology, Pulloor, Kariapatti, Tamil Nadu, India; Department of CS & IT, Kalinga University, Raipur, India; Department of Mathematics, Saveetha Institute of Medical and Technical Sciences, Chennai, Tamilnadu, India",2025 International Conference on Metaverse and Current Trends in Computing (ICMCTC),"17 Oct 2025","2025","","","1","5","Due to the massive explosion of big data, efficient data lakes with ‘real-time’ data management and ‘autonomous’ query optimization have become inevitable. One of the problems attached to traditional data lakes is the difficulty of retrieving data, which is slow to query, inefficiently, and with high complexities of schema evolution the ability of the data lake to optimize workloads dynamically. To overcome these problems, the work presented in this paper brings forward the concept of an AI-optimized data lake framework that exploits machine learning and deep learning for intelligent data ingestion, adaptive indexing as well as self-optimizing query execution. The system is proposed to incorporate hierarchical storage management with AI-driven, self-studying indexing mechanisms, and reinforcement learning-aided query optimization to improve data retrieval efficiency. Furthermore, through an integrated AI-powered anomaly detection system, data processing is made robust and reliable in real time. On top of that the framework also involves autonomous governance and security that can use explainable AI for compliance auditing and a dynamic role-based access control (RBAC). Experimental evaluations show that, with up to a 90% time saving, and with real-time decision-making capabilities, it improves over both aspects in a variety of data workloads. This research brings forth the integration of AI-based optimizations for the development of a broad and flexible framework for intelligently and scaleably building large data lake architectures, thus becoming the future-ready solution for any big data ecosystem within healthcare, financial, or IoT-based smart systems.","","979-8-3315-3821-7","10.1109/ICMCTC62214.2025.11196397","","https://ieeexplore.ieee.org/stamp/stamp.jsp?arnumber=11196397","Role-based access control;AI-driven;Healthcare;Hadoop Distributed File System","Access control;Data ingestion;Accuracy;Query processing;Storage management;Medical services;Big Data applications;Real-time systems;Anomaly detection;Indexing","","","","14","IEEE","17 Oct 2025","10-11 April 2025","10-11 April 2025","IEEE","IEEE Conferences"
"Machine Learning Techniques for Enhancing Maritime Surveillance Based on GMTI Radar and AIS","K. Dästner; B. von Haßler zu Roseneckh-Köhler; F. Opitz; M. Rottmaier; E. Schmid","AIRBUS, Wörthstraße 85, Ulm, Germany; AIRBUS, Wörthstraße 85, Ulm, 89077, Germany; AIRBUS, Wörthstraße 85, Ulm, Germany; AIRBUS, Wörthstraße 85, Ulm, Germany; AIRBUS, Wörthstraße 85, Ulm, Germany",2018 19th International Radar Symposium (IRS),"30 Aug 2018","2018","","","1","10","Classical maritime surveillance systems are enhanced with disruptive elements comingf om big data and machine learning. Available receiver networks deliver a huge amount of worldwide maritime traffc data. The information includes the position as well as signifcant attributes of all vessels, which are equipped with AIS. The processing of this data lake with modern machine learning and big data techniques offer improved decision support for the user. This is especially the case, when AIS is not available and only sensor information, e.g., GMTI is gathered. New design concepts – e.g. the lambda architecture offer the modular integration of these new assets within existing surveillance systems.","2155-5753","978-3-7369-9545-1","10.23919/IRS.2018.8447961","","https://ieeexplore.ieee.org/stamp/stamp.jsp?arnumber=8447961","","Marine vehicles;Surveillance;Machine learning;Clustering algorithms;Big Data;Radar","","12","","20","","30 Aug 2018","20-22 June 2018","20-22 June 2018","IEEE","IEEE Conferences"
"8 Smart grid–based big data analytics using machine learning and artificial intelligence: a survey","S. Koshy; S. Rahul; R. Sunitha; E. P. Cheriyan",NA; NA; NA; NA,Artificial Intelligence and Internet of Things for Renewable Energy Systems,"","2022","","","241","278","Exhilarating developments in the renewable energy generation portfolio and the widespread introduction of microgrids have contributed to significant reforms in the existing power grid’s power flow patterns. Power grids around the world have upgraded to smart grid (SG) by introducing advanced monitoring technologies such as Advanced Metering Infrastructure (AMI), smart meters and Phasor Measurement Units (PMUs), which collect high-resolution electrical measurements across the system. This has brought in a massive amount of data, termed big data, that needs to be efficiently processed to derive valuable insights. Specifically, technical sophistication, security, and integration of datasets are the main concerns that need to be tackled to transform the massive dataset into useful insights. This chapter surveys big data analytics (BDA) and its related benefits, challenges, and advancements in SG’s perspective. BDA in combination with visualization tools, help in the predictive decision-making process in the SG. Thus, data analytics play a significant part in the efficient monitoring of the SG. Powered with the integration of information and communication technologies, an information layer has been introduced to the traditional power systems to collect, store, and process data from smart meters and sensor implementations. Big data architecture involves data aggregation, storing, and analytics, which integrates the SG’s need for a range of frameworks with outstanding computational skills to respond to the customer’s needs. Characterization of big data, SGs, and massive volumes of data processing is first addressed as a preface to demonstrate the motivation and possible benefits of integrating advanced data mining in smart grids. Specific principles and standard data analytics techniques for general concerns are also discussed. The chapter’s key section discusses the advanced uses of various data analytics in SG, leveraging machine learning (ML) and artificial intelligence (AI). SG is benefited from the inherent capacity of ML to generalize, delivering reliable and quick power flow predictions from dispersed measurement units, with superior computing performance and interoperability. The chapter explores numerous literary works that utilize various ML methods to enhance SG activity and management. We will present big data analytics and cloud infrastructure in this chapter and address their importance to SG. Specifically, we would concentrate on relevant computational concerns and solutions linked to SG cyber-physical protection and safety.","","9783110714159","","","https://ieeexplore.ieee.org/xpl/ebooks/bookPdfWithBanner.jsp?fileName=10789589.pdf&bkn=10783464&pdfType=chapter","","Big Data;Power system reliability;Monitoring;Renewable energy sources;Real-time systems;Electrical engineering;Telecommunication network reliability;Smart grids;Power system stability;Load flow","","","","","","16 Jan 2025","","","De Gruyter","De Gruyter eBook Chapters"
"Omnichannel Retail Analytics: A Scalable Big Data Architecture Using Data Vault 2.0 and Apache Spark for Retail Intelligence","U. Kumar; D. Krishnamoorthy; R. Ghadiyaram",NA; NA; NA,2025 IEEE Conference on Cloud and Big Data Computing (CBDCom),"23 Jan 2026","2025","","","207","212","Retailers often struggle to integrate data from disparate sources such as their eCommerce platforms, physical stores, and inventory systems. This fragmentation hampers timely decision-making, creates inconsistent customer experiences, and complicates regulatory compliance. To address these challenges, this paper proposes a scalable, intelligent data warehousing architecture for retail applications utilizing Data Vault 2.0 in conjunction with Apache Spark. This innovative framework facilitates the aggregation, management, and analysis of omnichannel data, ensuring flexibility, traceability, and scalability. A synthetic simulation, based on representative retail data, validates the architecture's performance and adaptability. The integration of Data Vault 2.0 and Apache Spark provides a powerful solution for managing and analyzing retail data, empowering retailers to derive rapid insights and respond swiftly to market dynamics.","","979-8-3315-9094-9","10.1109/CBDCom68404.2025.00036","","https://ieeexplore.ieee.org/stamp/stamp.jsp?arnumber=11344184","Data Vault 2.0;Apache Spark;Data Warehousing;eCommerce;Retail;POS;ETL;Omnichannel;Big Data;Intelligent Systems;Retail Analytics","Scalability;Warehousing;Decision making;Cluster computing;Computer architecture;Big Data;Electronic commerce;Intelligent systems","","","","16","IEEE","23 Jan 2026","21-24 Oct. 2025","21-24 Oct. 2025","IEEE","IEEE Conferences"
"Implementation of RAG-LLM Based AI Agents for Public Service Innovation: RAG System Architecture Analysis and A Cross-National Case Study","J. Ryu; Y. Woo; K. Lee","Ph.D. Candidate of the Graduate Program in IT Policy and Management, Soongsil University, Seoul, Republic of Korea; School of Public Administration, Soongsil University, Seoul, Republic of Korea; Ph.D. Student of the Graduate Program in IT Policy and Management, Soongsil University","2025 IEEE/ACIS 29th International Conference on Software Engineering, Artificial Intelligence, Networking and Parallel/Distributed Computing (SNPD)","28 Nov 2025","2025","","","308","321","The rapid adoption of Retrieval-Augmented Generation (RAG) integrated with Large Language Models (LLMs) is transforming public sector services by addressing the limitations of conventional AI, such as outdated knowledge, hallucination, and regulatory compliance challenges. This study investigates the transformative potential of Retrieval-Augmented Generation integrated with Large Language Models (RAG-LLM) in public service innovation through architectural analysis and cross-national case studies of Estonia, Singapore, and the European Union. By examining RAG-LLM implementations across legal, administrative, and multilingual domains, the research identifies critical success factors in governance models, interoperability frameworks, and data standardization.Key findings reveal that centralized architectures (Estonia’s Kratt ecosystem, Singapore’s AIBots) enable rapid scaling through unified standards, while federated models (EU’s cross-border system) balance sovereignty with collaboration. Hybrid retrieval strategies-combining keyword-based and semantic search-and domain-specific embeddings reduce hallucinations by up to 63%, ensuring compliance and accuracy in high-stakes scenarios. Operational efficiencies are significant: Estonia processes 1.2M monthly queries with 89% resolution rates, Singapore automates 40% more citizen inquiries, and the EU reduces permit processing from six weeks to three days. Citizen satisfaction rates (82–98%) correlate with transparency features (source citations, multilingual support) and inclusive design.The study underscores that RAG-LLM systems act as force multipliers for public sector innovation when supported by adaptive governance, continuous data quality management, and standardized evaluation metrics. Challenges persist in generalizability to less digitized contexts, ethical governance, and evolving regulatory landscapes. Policy recommendations emphasize interoperability frameworks, domain-tuned standardization, and human-AI collaboration to realize scalable, trustworthy, and citizen-centric services.","2693-8421","979-8-3315-1258-3","10.1109/SNPD65828.2025.11252835","","https://ieeexplore.ieee.org/stamp/stamp.jsp?arnumber=11252835","Retrieval-Augmented Generation;public sector AI;interoperability;digital governance;citizen-centric services;cross-national case study","Technological innovation;Law;Large language models;Retrieval augmented generation;Europe;Collaboration;Data models;Multilingual;Artificial intelligence;Interoperability","","","","16","IEEE","28 Nov 2025","25-27 June 2025","25-27 June 2025","IEEE","IEEE Conferences"
"An Novel Approach in Designing a Security Workbench with Deep Learning Capabilities and Process Automation","S. Vijayakumar; K. S. P. Gowtham; N. Nigam; R. V. R. Singh","Hitech DET, TATA Consultancy Services, Coimbatore, India; Hitech DET, TATA Consultancy Services, Coimbatore, India; Hitech DET, TATA Consultancy Services, Lucknow, India; Hitech DET, TATA Consultancy Services, Lucknow, India",TENCON 2019 - 2019 IEEE Region 10 Conference (TENCON),"12 Dec 2019","2019","","","263","268","To start with a proverb “It takes 20 years to build a reputation and few minutes of cyber-incident to ruin it” by Stephane Nappo. The number of cyber security attack over the Internet and Network is growing exponentially every day. The conventional approach of detecting malicious activity through the blacklists and controlling their access at the organization level not going to be effective in the near future. It is necessary to apply novel approaches based on Artificial Intelligence (AI) and Deep Learning (DL) techniques to detect cyber security attack pattern and bring down the time to react with seamless automation process. The challenge is to build a Deep Learning Model to predict the next sequence of attack pattern from different digital sources and zones is not automated traditionally, decision making for the security analysts and right solution recommendation from previous knowledge is a nightmare for large enterprise in the era towards uncompromised “Digital World”. Proposed security workbench will bring in the advanced analytical capabilities, intelligence and automation in cyber security attack detection and security fix process automation.","2159-3450","978-1-7281-1895-6","10.1109/TENCON.2019.8929691","","https://ieeexplore.ieee.org/stamp/stamp.jsp?arnumber=8929691","Cyber Security;Security Workbench;Data Lake;Machine Learning;Deep Learning;Automation","Security;Predictive models;Machine learning;Training;Automation;Computer architecture;Analytical models","","","","11","IEEE","12 Dec 2019","17-20 Oct. 2019","17-20 Oct. 2019","IEEE","IEEE Conferences"
"Developing a Prototype Healthcare Data Platform for Advanced Analytics in Rehabilitation Environments","A. Foschi; D. Pistilli; G. Bondani; F. Rebecchi","R&D, Eustema S.p.A., Rome, Italy; R&D, Eustema S.p.A., Rome, Italy; R&D, Eustema S.p.A., Rome, Italy; R&D, Eustema S.p.A., Rome, Italy",2024 IEEE 8th Forum on Research and Technologies for Society and Industry Innovation (RTSI),"26 Nov 2024","2024","","","369","374","The rapid evolution of digital systems in the healthcare sector presents a significant opportunity to enhance rehabilitation outcomes through advanced analytics and personalized treatments. This advancement enables healthcare professionals to tailor rehabilitation programs to the individual needs of patients, leading to more effective and efficient recovery processes. Considering this, this paper introduces a prototype of data platform specifically designed to harness the potential of digital technology in the rehabilitation domain. The platform concept proposed herein integrates advanced data management tools and machine learning algorithms in order to leverage the vast amounts of data generated by healthcare devices. Specifically, the main purpose of this platform is to improve rehabilitation processes by offering tailored, data-driven insights that support healthcare professionals in making informed decisions. Utilizing open-source components, the prototype aims to demonstrate interoperability, scalability, and efficiency in processing and analyzing complex rehabilitation datasets. This paper concentrates on the architectural design, the plan for implementation, and the expected challenges and their solutions in the development of this platform. Additionally, it outlines the original contributions of the research, including advancements in data management techniques and interoperability standards. The prototype discussed here is developed as part of the “Fit4MedRob” initiative, a scientific project sponsored by the Italian Ministry of University and Research, that aims to overhaul rehabilitative models for individuals with compromised motor and cognitive functions through cutting-edge bio robotic technologies. This initiative spans a total of 44 months and seeks to address the unmet needs of patients and healthcare providers with innovative robotic and digital technologies.","2687-6817","979-8-3503-6213-8","10.1109/RTSI61910.2024.10761573","","https://ieeexplore.ieee.org/stamp/stamp.jsp?arnumber=10761573","healthcare data platform;rehabilitation technology;hl7 fhir;data interoperability;data anonymization;healthcare data lake;clinical trials;decision support system","Technological innovation;Data analysis;Scalability;Prototypes;Medical services;Motors;Protection;Robots;Interoperability;Standards","","","","36","IEEE","26 Nov 2024","18-20 Sept. 2024","18-20 Sept. 2024","IEEE","IEEE Conferences"
"Evaluating the Quality of Social Media Data in Big Data Architecture","A. Immonen; P. Pääkkönen; E. Ovaska","VTT Technical Research Centre of Finland, Oulu, Finland; VTT Technical Research Centre of Finland, Oulu, Finland; VTT Technical Research Centre of Finland, Oulu, Finland",IEEE Access,"20 May 2017","2015","3","","2028","2043","The use of freely available online data is rapidly increasing, as companies have detected the possibilities and the value of these data in their businesses. In particular, data from social media are seen as interesting as they can, when properly treated, assist in achieving customer insight into business decision making. However, the unstructured and uncertain nature of this kind of big data presents a new kind of challenge: how to evaluate the quality of data and manage the value of data within a big data architecture? This paper contributes to addressing this challenge by introducing a new architectural solution to evaluate and manage the quality of social media data in each processing phase of the big data pipeline. The proposed solution improves business decision making by providing real-time, validated data for the user. The solution is validated with an industrial case example, in which the customer insight is extracted from social media data in order to determine the customer satisfaction regarding the quality of a product.","2169-3536","","10.1109/ACCESS.2015.2490723","Tekes and VTT through the DIGILE’s Need for Speed Program; ","https://ieeexplore.ieee.org/stamp/stamp.jsp?arnumber=7299603","architecture;big data;metadata;quality attribute;quality of data;Architecture;big data;metadata;quality attribute;quality of data","Big data;Social network services;Computer architecture;Meta data;Online services","","94","","52","OAPA","16 Oct 2015","2015","","IEEE","IEEE Journals"
"Connection of Dynamic and Static Data: A Data Lake for Building Digitalisation","J. L. Hernández; D. Arévalo; S. Martín; K. Katsigarakis; G. N. Lilis; D. Rovas; I. De Miguel","Energy Division, CARTIF technology centre, Boecillo, Spain; Energy Division, CARTIF technology centre, Boecillo, Spain; Energy Division, CARTIF technology centre, Boecillo, Spain; IEDE University College London, London, UK; IEDE University College London, London, UK; IEDE University College London, London, UK; Universidad de Valladolid, Valladolid, Spain",2024 IEEE International Workshop on Metrology for Living Environment (MetroLivEnv),"6 Aug 2024","2024","","","262","267","The landscape of building data is expanding, with heterogeneous sources that are often treated as isolated silos across different building domains such as energy, architecture elements, or automation networks. This siloed approach creates a lock-in scenario, limiting the potential for effective data exploitation, including the provision of added-value services, artificial intelligence, or machine-learning activities. To overcome this challenge, ensuring data integration through interoperability mechanisms becomes crucial within building data management frameworks. In line with this perspective, this work introduces a data lake that harmonizes heterogeneous data sources from various building domains. The primary goal is to standardize datasets, ensuring the delivery of high-quality services to facilitate better decision-making. These datasets are enriched by interactions between static and dynamic datasets. This holistic approach aims to break down silos and unlock the full potential of building data for informed decision-making processes.","","979-8-3503-8501-4","10.1109/MetroLivEnv60384.2024.10615827","","https://ieeexplore.ieee.org/stamp/stamp.jsp?arnumber=10615827","","Soft sensors;Buildings;Semantics;Decision making;Sociology;Data collection;Big Data applications","","","","13","IEEE","6 Aug 2024","12-14 June 2024","12-14 June 2024","IEEE","IEEE Conferences"
"Empowering the Tribal people with the use of big data processing expert system in animal Husbandry and Poultry Farming application","R. Saravanan; V. Nehru; S. Muthuselvi","Department of Computer Science & Engineering, Vel Tech Multi Tech Dr. Rangarajan & Dr. Sakunthala Engineering College, Chennai, Avadi, India; Department of Computer Science & Engineering, Vel Tech Multi Tech Dr. Rangarajan & Dr. Sakunthala Engineering College, Chennai, Avadi, India; Department of Computer Science & Engineering, Vel Tech Multi Tech Dr. Rangarajan & Dr. Sakunthala Engineering College, Chennai, Avadi, India","2023 International Conference on Research Methodologies in Knowledge Management, Artificial Intelligence and Telecommunication Engineering (RMKMATE)","3 Jan 2024","2023","","","1","8","The population of the tribal people has been decreased day by day in India due to the lack of awareness in health related issues and there is a series challenges in their sustainable livelihood. The Particularly Vulnerable People from tribal groups (PVTGs) engaged in animal husbandry and poultry farming as their primary source of income, which improves their standard of living. Maintain and safeguard poultry and animals from diseases is a cumbersome process. Providing enough medical facility is still a challenging task due to the geographical location and unavailability of the infrastructure and human resources. The proposed framework uses Apache Kafka-Apache Storm-NoSQL Mongo DB architecture to process enormous volume of sensor data in real time and it receives the sensor data and uses it to create the various disease identification models. The processed data are stored in Mongo DB as a historical data. The system provides a Web-based monitoring system for continuos monitoring the health conditions of cattles and poultry through the Smart Health Care Centre. Smartness in operation is performed through System on Chip (SoC) IoT system, the proposed big data expert system model transcends from the traditional functionalities of disease identification by the real time field visit analysis by the medical professionals. The proposed system is more suitable for the remote hill area. Smart Health Care system improves the disease identification accuracy and provides a powerful Big Data architecture for data analytics and data storage. The big data expert system frame work is underwent successful functional testing of ""SoC-IoT smart devices"" connected with the network and the performance of the network in terms of CPU, memory usage and the network delay is analyzed. Further the frame work uses the big data processing with the machine learning approach ""Hybrid diseases identification Model"" with the combination of DBSCAN for outlier detection together with Random Forest classification, which improves the disease identification accuracy of the various disease attacked the cattles and poultry.","","979-8-3503-0570-8","10.1109/RMKMATE59243.2023.10369174","","https://ieeexplore.ieee.org/stamp/stamp.jsp?arnumber=10369174","Apache Kafka;Apache Storm;Mongo DB;DBSCAN;Random Forest","Animals;Smart healthcare;Big Data;Data models;Real-time systems;Expert systems;Monitoring","","","","9","IEEE","3 Jan 2024","1-2 Nov. 2023","1-2 Nov. 2023","IEEE","IEEE Conferences"
