"Complex Event Processing for object tracking and intrusion detection in Wireless Sensor Networks","R. Bhargavi; V. Vaidehi; P. T. V. Bhuvaneswari; P. Balamuralidhar; M. G. Chandra","Department of IT, Anna Univerisity, Chennai, India; Department of IT, MIT, Anna University, Chennai, India; Department of Electronics, Anna University, Chennai, India; TCS Innovation Lab, Banglore, India; TCS Innovation Lab, Banglore, India",2010 11th International Conference on Control Automation Robotics & Vision,"4 Feb 2011","2010","","","848","853","Complex Event Processing (CEP) has received wider acceptability due to its systematic and multilevel architecture driven concept approach. CEP is an emerging technology in the field of data processing and identifying patterns of interest from multiple streams of events. High levels of integrated self learning applications can be developed. CEP is used in development of applications which have to deal with voluminous streams of incoming data with the task of finding meaningful events or patterns of events, and respond to the events of interest in real time. In this paper a CEP based application for object detection tracking in a Wireless Sensor Network (WSN) environment is proposed. Also the detection of an intruder using semantic query processing is proposed. ESPER, an open source Complex Event Processing engine is used to develop the application.","","978-1-4244-7815-6","10.1109/ICARCV.2010.5707288","","https://ieeexplore.ieee.org/stamp/stamp.jsp?arnumber=5707288","CEP;Wireless Sensor Network;Semantic Query;Intrusion;ESPER","Radiofrequency identification;Engines;Wireless sensor networks;Servers;Cameras;Real time systems;Streaming media","","8","","9","IEEE","4 Feb 2011","7-10 Dec. 2010","7-10 Dec. 2010","IEEE","IEEE Conferences"
"Designing a fusion of visible and infra-red camera streams for remote tower operations","A. Papenfuss; F. Reuschling; J. Jakobi; T. Rambau; E. Michaelsen; N. Scherer-Negenborn","Institut für Flugführung, Lilienthalplatz 7, Braunschweig, Germany; Institut für Flugführung, Lilienthalplatz 7, Braunschweig, Germany; Institut für Flugführung, Lilienthalplatz 7, Braunschweig, Germany; Institut für Flugführung, Lilienthalplatz 7, Braunschweig, Germany; Department Object Recognition, Fraunhofer-IOSB, Gutleuthausstrasse 1, Ettlingen, Germany; Department Object Recognition, Fraunhofer-IOSB, Gutleuthausstrasse 1, Ettlingen, Germany",2020 IEEE Aerospace Conference,"21 Aug 2020","2020","","","1","11","The research project INVIDEON evaluated requirements, technical solutions and the benefit of fusing visible (VIS) and infra-red (IR) spectrum camera streams into a single panorama video stream. In this paper, the design process for developing a usable and accepted fusion is described. As both sensors have strengthens and weaknesses, INVIDEON proposes a fused panorama optimized out of both sensors to be presented to the ATC officer (ATCO). This paper gives an overview of the project and reports results of acceptance and usability of the INVIDEON solution. The process of supporting the definition of requirements by means of rapid prototyping and taking a user-centered approach is described. Main findings of requirements for fusing VIS and IR camera data for remote tower operations are highlighted and set into context with the air traffic controller's tasks. A specific fusion approach was developed within the project and evaluated by means of recorded IR and VIS data. For evaluation, a testbed was set up at a regional airport and data representing different visibility conditions were selected out of 70 days data recordings. Five air traffic controllers participated in the final evaluation. Subjective data on perceived usability, situational awareness and trust in automation was assessed. Furthermore, qualitative data on HMI design and optimization potential from debriefings and comments was collected and clustered.","1095-323X","978-1-7281-2734-7","10.1109/AERO47225.2020.9172645","","https://ieeexplore.ieee.org/stamp/stamp.jsp?arnumber=9172645","","Poles and towers;Sensor fusion;Streaming media;Cameras;Rapid prototyping;Sensors;Recording;Usability;Streams;Optimization","","2","","22","IEEE","21 Aug 2020","7-14 March 2020","7-14 March 2020","IEEE","IEEE Conferences"
"Network System of Systems Manager","J. Dobie; R. Holder","L3Harris Technologies, Inc., Melbourn, Florida; L3Harris Technologies, Inc., Melbourn, Florida","2024 Integrated Communications, Navigation and Surveillance Conference (ICNS)","11 Jun 2024","2024","","","1","14","For several decades, the L3Harris Mission Networks organization has perfected the design, deployment, operations, and management of enterprise-level networks for safety-critical missions using a managed service framework. L3Harris has successfully constructed geographically large and technologically diverse Local Area Network (LAN)/Wide Area Network (WAN) solutions for State and Federal customers by selecting, optimizing, and integrating Commercial off the Shelf (COTS) products and services into an integrated or homogeneous solution meeting exacting performance requirements. These purpose-built network solutions ensure performance and resilience through tailored provisioning and the configuration of highly reliable (e.g., through adaptive redundancy) architectures, diverse service connections and equipment, ubiquitous bandwidth allocation and an unparalleled telecommunication provider governance by a centralized operational support system.Over this same period, there have been key advances in the networking industry which signal the need to evolve beyond our centralized managed services model. These advances include the rapid industry transition from a dedicated Time-division Multiple Access (TDMA)-based solution to multifunction IP-based networks with Quality of Service (QoS) support, the growing deployment of Software Defined Everything (SDE), AI-assisted advanced modeling and simulation, near-universal adoption of cloud-based Infrastructure as a Service (IaaS), design patterns and deployment solutions with the increasing presence of wireless services such as 5G (both fixed and mobile), Long Term Evolution (LTE), Geostationary Orbit (GEO), Low Earth Orbit (LEO) and Medium Earth Orbit (MEO).Within these evolving technologies, network management solutions can move from centralized to federated architectures with the promise of effortless scalability, dynamic adaptability, and seamless collaboration. A federated hierarchical architecture offers organizations a blueprint allowing coordinated management, interoperability of data, resources and processes across heterogeneous systems, locations, and organizational boundaries. To take maximum advantage of such an architecture, we believe there is an opportunity to streamline and optimize network designs through an implementation of a Network System of Systems Manager (NSoSM). The NSoSM is a centralized system used to ingest network telemetry data across one or more networks, process data via AI/ML algorithms, to make informed decisions to improve the delivery of prioritized customer data and improve the usability of mission critical customer applications.The federated architecture construct, consisting of loosely coupled constituent databases for sharing and data exchange, has evolved beyond its origin and the set of standards facilitating its integration. The use of an Open Platform Communications (OPC) Unified Architecture (UA) [01], the International Society of Automation (ISA)-95 model [02], the Manufacturing Enterprise Solutions Association (MESA) Business to Manufacturing Markup Language (B2MML) [03], and message exchange models have improved integration and scalability, resulting in wide adoption in manufacturing environments.The adoption of a federated architecture in enterprise-level, mission critical networks present several challenges. The solution to these challenges can be addressed with three primary capabilities: 1) Integrated Situational Awareness; 2) Integration Gateway, and 3) AI Augmentation and Automated Orchestration, carrying independent value and, when fused together, achieve a NSoSM which autonomously supports a federated ecosystem:Integrated Situational Awareness. Adapting to the increasing volume of technological solutions, the need for highly customized service integrator solutions evolves from a centralized integration of disparate platforms to an enterprise orchestration of integrated System-of-Systems (SoS). This is achieved through creating a hyperconverged monitoring and data collection capability of system logs, synthetic network probes, streaming telemetry and real-time channel performance metrics collected by Fault Management Systems, Network Performance Monitoring and Diagnostics Systems, and Application Performance Monitoring systems. Integrating these COTS solutions, together with Situational Awareness, offer end-to-end (E2E) planning, fault analysis, and command and control (C2) of regulated network environments.Integration Gateway. Of critical importance in the NSoSM model is the need to create a homogeneous, clear user experience across a heterogeneous collection of federated systems. This involves the definition and harmonization of the exchanged data and the technologies used for sending and receiving the exchanged data with intelligent markers to incorporate customer and mission-defined, protections. This involves both the harmonization of data from dissimilar heterogeneous end-systems to a common operating picture and to convert it back to native system languages when suggested configurations are being recommended to optimize customer service performance.AI Augmentation and Automated Orchestration (AIA2O). This capability is comprised of three primary and sequential functions: Datasets, Frameworks and Procedure Validation for AIOps and Command and Control (C2) Orchestration. Data from the Integration Gateway is interpreted into logical threads where Artificial Intelligence (AI)/Machine Learning (ML) algorithms and models apply insight to optimizations required for an improved User Experience (UX), via autonomous orchestration, reducing and sometimes eliminating the human-in-the-loop delay not only reducing the decision chain but also reducing human error. Insights and procedures are validated in a digital twin representation followed by the orchestration of optimizations in a production environment.The Federal Aviation Administration’s publication of Initial Concept of Operations for an Info-Centric National Airspace System asserts that ""The integrated information environment, providing data services including data integration from various sources, allows federated actors to reconcile, contextualize, and share relevant information’’. Additionally, value is perceived by enabling ""multiple entities to provide a federated set of xTM services for flights operating within the same airspace"". Implementing and operating NSoSM capabilities, comprised of an integrated gateway, integrated situational awareness, and AI augmentation and automated orchestration are at the core of where mission critical, enterprise-level networks and SDE are evolving for State, Federal, and Department of Defense (DoD) organizations. L3Harris’ approach to the design of a NSoSM solution provides a limitless overlay adapting to emerging and evolving technologies, meanwhile reduce operating expenses (OpEx) via an ever-growing AI community, enabling independent systems to collectively deliver value that cannot be achieved independently.","2155-4951","979-8-3503-9309-5","10.1109/ICNS60906.2024.10550591","","https://ieeexplore.ieee.org/stamp/stamp.jsp?arnumber=10550591","Network Automation;Machine Learning;Autonomous Networking;Network Data Analytics;Situational Awareness","Command and control systems;Adaptive systems;Mission critical systems;Computer architecture;Organizations;Logic gates;User experience","","2","","12","IEEE","11 Jun 2024","23-25 April 2024","23-25 April 2024","IEEE","IEEE Conferences"
"Leveraging Scalable Cloud Infrastructure for Autonomous Driving Data Lakes and Real-Time Decision Making","J. Chen","Graduate School of Arts and Sciences, Columbia University, New York, United States",2025 5th International Conference on Artificial Intelligence and Industrial Technology Applications (AIITA),"1 Jul 2025","2025","","","1750","1753","Autonomous driving technology relies heavily on the effective management of vast datasets generated by various sensors and vehicle systems. As such, leveraging scalable cloud infrastructure becomes paramount for improving data handling and decision-making capabilities. In this paper, we introduce the Autonomous Driving Data Lakes (ADDL) framework, designed to streamline the storage, retrieval, and processing of extensive driving data in real-time. By utilizing cloud technology, ADDL ensures tight integration of data from diverse sources to enhance situational awareness for autonomous systems. Our architecture features robust data pipelines that support real-time analytics and machine learning applications, which are crucial for timely and accurate decision-making. Extensive experiments with large-scale datasets demonstrate how our approach significantly boosts processing efficiency, data accessibility, and decision-making reliability. The findings highlight advancements in autonomous driving technologies, addressing the challenges associated with data management and enhancing operational effectiveness in changing driving environments.","","979-8-3315-0976-7","10.1109/AIITA65135.2025.11048068","","https://ieeexplore.ieee.org/stamp/stamp.jsp?arnumber=11048068","Cloud Infrastructure;Autonomous Driving;Decision Making","Decision making;Pipelines;Machine learning;Big Data applications;Real-time systems;Sensor systems;Telemetry;Reliability;Autonomous vehicles;Intelligent sensors","","","","18","IEEE","1 Jul 2025","28-30 March 2025","28-30 March 2025","IEEE","IEEE Conferences"
"A new framework for on-demand virtualization, repurposing and fusion of heterogeneous sensors","Y. Liu; D. Hill; A. Rodriguez; L. Marini; R. Kooper; J. Myers; Xiaowen Wu; B. Minsker","National Center of Supercomputing Applications, University of Illinois, Urbana-Champaign, Urbana, IL, USA; National Center of Supercomputing Applications, University of Illinois, Urbana-Champaign, Urbana, IL, USA; National Center of Supercomputing Applications, University of Illinois, Urbana-Champaign, Urbana, IL, USA; National Center of Supercomputing Applications, University of Illinois, Urbana-Champaign, Urbana, IL, USA; National Center of Supercomputing Applications, University of Illinois, Urbana-Champaign, Urbana, IL, USA; National Center of Supercomputing Applications, University of Illinois, Urbana-Champaign, Urbana, IL, USA; Department of Civil and Environmental Engineering, University of Illinois, Urbana-Champaign, Urbana, IL, USA; Department of Civil and Environmental Engineering, University of Illinois, Urbana-Champaign, Urbana, IL, USA",2009 International Symposium on Collaborative Technologies and Systems,"5 Jun 2009","2009","","","54","63","This paper describes our first step towards the realization of complex and large scale cross-organization virtual observatories by presenting a new semantically-enhanced ldquosensor network as a servicerdquo (SNaaS) framework, which can repurpose existing sensor networks as needed and aggregate and fuse heterogeneous sensors into new virtual sensors in near-real-time. The architecture of this system allows users to create virtual sensors in a Web 2.0 collaborative map interface. Components of the system are highlighted in the paper including a semantically enhanced streaming data toolkit, virtual sensor ontologies and management middleware. Case studies are presented which can allow users to create new virtual rain gages based on the NEXRAD (next generation weather radar) data stream with or without in-situ rain gages on demand in a Chicago urban watershed testbed. The resulting virtual sensor data streams then can be published in multiple formats including a SWE-compliant one so that external SWE-compliant users and applications can seamlessly query and integrate them.","","978-1-4244-4584-4","10.1109/CTS.2009.5067462","","https://ieeexplore.ieee.org/stamp/stamp.jsp?arnumber=5067462","Sensor Web;Virtual Sensor;Ontology;Streaming Data Management;Data Fusion;Web 2.0","Sensor fusion;Sensor phenomena and characterization;Sensor systems;Rain;Large-scale systems;Observatories;Aggregates;Fuses;Service oriented architecture;Collaboration","","9","","51","IEEE","5 Jun 2009","18-22 May 2009","18-22 May 2009","IEEE","IEEE Conferences"
"Biomedical Big Data Analytics for Patient-Centric and Outcome-Driven Precision Health","M. D. Wang","Georgia Institute of Technology and Emory University, USA",2015 IEEE 39th Annual Computer Software and Applications Conference,"24 Sep 2015","2015","3","","1","2","Rapid advancements in biotechnologies such as -omic (genomics, proteomics, metabolomics, lipidomics etc.), next generation sequencing, bio-nanotechnologies, molecular imaging, and mobile sensors etc. accelerate the data explosion in biomedicine and health wellness. Multiple nations around the world have been seeking novel effective ways to make sense of ""big data"" for evidence-based, outcome-driven, and affordable 5P (Patient-centric, Predictive, Preventive, Personalized, and Precise) healthcare. My main research focus is on multi-modal and multi-scale (i.e. molecular, cellular, whole body, individual, and population) biomedical data analytics for discovery, development, and delivery, including translational bioinformatics in biomarker discovery for personalized care; imaging informatics in histopathology for clinical diagnosis decision support; bionanoinformatics for minimally-invasive image-guided surgery; critical care informatics in ICU for real-time evidence-based decision making; and chronic care informatics for patient-centric health. In this talk, first, I will highlight major challenges in biomedical and health informatics pipeline consisting of data quality control, information feature extraction, advanced knowledge modeling, decision making, and proper action taking through feedback. Second, I will present informatics methodological research in (i) data integrity and integration; (ii) case-based reasoning for individualized care; and (iii) streaming data analytics for real-time decision support using a few mobile health case studies (e.g. Sickle Cell Disease, asthma, pain management, rehabilitation, diabetes etc.). Last, there is big shortage of data scientists and engineers who are capable of handling Big Data. In addition, there is an urgent need to educate healthcare stakeholders (i.e. patients, physicians, payers, and hospitals) on how to tackle these grant challenges. I will discuss efforts such as patient-centric educational intervention, community-based crowd sourcing, and Biomedical Data Analytics MOOC development. Our research has been supported by NIH, NSF, Georgia Research Alliance, Georgia Cancer Coalition, Emory-Georgia Tech Cancer Nanotechnology Center, Children's Health Care of Atlanta, Atlanta Clinical and Translational Science Institute, and industrial partners such as Microsoft Research and HP.","0730-3157","978-1-4673-6564-2","10.1109/COMPSAC.2015.343","","https://ieeexplore.ieee.org/stamp/stamp.jsp?arnumber=7273312","","Biomedical imaging;Informatics;Bioinformatics;Big data;Cancer;Decision making","","7","","","IEEE","24 Sep 2015","1-5 July 2015","1-5 July 2015","IEEE","IEEE Conferences"
"An integration of data mining and data warehousing for hierarchical multimedia information retrieval","J. You; T. Dillon; J. Liu","School of Computing and Information Technology, Griffith University, Brisbane, QLD, Australia; Department of Computing, Hong Kong Polytechnic University, Hung Hom, Hong Kong, China; Department of Computing, Hong Kong Polytechnic University, Hung Hom, Hong Kong, China","Proceedings of 2001 International Symposium on Intelligent Multimedia, Video and Speech Processing. ISIMP 2001 (IEEE Cat. No.01EX489)","7 Aug 2002","2001","","","373","376","The paper presents a new approach to multimedia information retrieval with data warehousing techniques. To tackle the key issues such as multimedia data representation, storage, integration, indexing, similarity measures, searching methods and query processing, the proposed algorithms allow one: 1) to extend the concepts of conventional data warehouse and multimedia database to multimedia data warehouse for effective data representation and storage; 2) to develop a multimedia starflake schema to integrate multiple data streams for hierarchical data representation and indexing; 3) to introduce a dynamic similarity measurement scheme based on statistical feature selection criteria; 4) to apply data aggregation techniques for decision support to speed up query processing and searching. We conclude that the proposed approach can be applied to general multimedia systems with effective data storage, retrieval and integration.","","962-85766-2-3","10.1109/ISIMP.2001.925411","","https://ieeexplore.ieee.org/stamp/stamp.jsp?arnumber=925411","","Data mining;Warehousing;Multimedia databases;Streaming media;Information retrieval;Indexing;Velocity measurement;Query processing;Data warehouses;Multimedia systems","","5","","14","IEEE","7 Aug 2002","4-4 May 2001","4-4 May 2001","IEEE","IEEE Conferences"
"AI and IoT-Enabled Railway Safety System for Automated Monitoring and Early Warning","M. V; S. K. S; P. S; S. S; V. E","Electronics and Communication Engineering, M. Kumarasamy College of Engineering, Karur, India; Electronics and Communication Engineering, M. Kumarasamy College of Engineering, Karur, India; Electronics and Communication Engineering, M. Kumarasamy College of Engineering, Karur, India; Electronics and Communication Engineering, M. Kumarasamy College of Engineering, Karur, India; Electronics and Communication Engineering, M. Kumarasamy College of Engineering, Karur, India",2025 5th International Conference on Ubiquitous Computing and Intelligent Information Systems (ICUIS),"13 Feb 2026","2025","","","1170","1174","Human and animal railway intrusions continue to be a serious issue of concern to transportation security, resulting in heavy operational and economic losses. This paper introduces an intelligent, AI-based railway safety system combining deep learning and Internet of Things (IoT) technologies for real-time intrusion detection and alerting. The system to be implemented employs YOLOv8 object detection algorithm to reliably detect human beings, animals, and foreign bodies on railroad tracks from video streams. The identified anomalies initiate an automatic alert system, which captures the time stamp of the event, location coordinates, and annotated visual proof. The alert is sent instantly to responsible authorities via IoT-based communication modules for quick response and containment. Experimental confirmation under different illumination and environmental conditions exhibits high detection accuracy, minimal false-alarm rates, and real-time performance stability. The suggested scheme is able to significantly reduce human intervention, enhance situational awareness, and enhance response efficiency. Through the integration of AI-enabled vision analytics and IoT connectivity, the system provides a deployable, cost-effective, and scalable answer to augment railway infrastructure safety at the national level.","","979-8-3315-5284-8","10.1109/ICUIS67429.2025.11380719","","https://ieeexplore.ieee.org/stamp/stamp.jsp?arnumber=11380719","Railway safety;YOLOv8;Internet of Things (IoT);Intrusion detection;Computer vision;Image Processing","Deep learning;Animals;Railway safety;Transportation;Thermal sensors;Rail transportation;Real-time systems;Safety;Internet of Things;Reliability","","","","14","IEEE","13 Feb 2026","26-28 Nov. 2025","26-28 Nov. 2025","IEEE","IEEE Conferences"
