"Solution for detecting sensitive data inside a data lake","S. Tovernić; V. Banović; Z. Hrastić; K. Plantić; A. Šandić; M. Baranović","Faculty of Electrical Engineering and Computing, Zagreb, Croatia; Faculty of Electrical Engineering and Computing, Zagreb, Croatia; Faculty of Electrical Engineering and Computing, Zagreb, Croatia; Faculty of Electrical Engineering and Computing, Zagreb, Croatia; Faculty of Electrical Engineering and Computing, Zagreb, Croatia; Faculty of Electrical Engineering and Computing, Zagreb, Croatia","2018 41st International Convention on Information and Communication Technology, Electronics and Microelectronics (MIPRO)","2 Jul 2018","2018","","","1284","1288","This paper is the result of a project realized by a team of current master's degree students. The team created an algorithm for recognition of sensitive data, primarily name, surname and OIB (Croatian personal identification number). Same algorithm iterates across given unstructured texts and appoints tags for documents considering the existence of specific sensitive data. This process offers a way for companies to narrow down the search for personal information if a client demands removal of his data. Similar algorithm was implemented for working with server logs as well, which are represented as data streams and analysed in real time. To provide insight on the quantity of sensitive information and how it is distributed across different types of documents the team created a dashboard that shows statistical data accumulated by developed algorithms. The solution is stored on Cloudera, Apache Hadoop-based open source platform designed for data management and analytics, which is deployed on Microsoft Azure cloud infrastructure.","","978-953-233-095-3","10.23919/MIPRO.2018.8400232","","https://ieeexplore.ieee.org/stamp/stamp.jsp?arnumber=8400232","","Electric potential;Software algorithms;Semantics;Tagging;Software;Real-time systems;Teamwork;Microelectronics;Information and communication technology;Servers","","6","","20","","2 Jul 2018","21-25 May 2018","21-25 May 2018","IEEE","IEEE Conferences"
"Consideration and Research on Data Architecture for the Future Cyber Society","F. Miao; W. Yang; Y. Xie; W. Fan","Big Data Research Institute, Chengdu University, Chengdu, China; Cyber Security College, Chengdu University of Technology, Chengdu, China; Geophysics College, Chengdu University of Technology, Chengdu, China; Big Data Research Institute, Chengdu University, Chengdu, China","2019 IEEE SmartWorld, Ubiquitous Intelligence & Computing, Advanced & Trusted Computing, Scalable Computing & Communications, Cloud & Big Data Computing, Internet of People and Smart City Innovation (SmartWorld/SCALCOM/UIC/ATC/CBDCom/IOP/SCI)","9 Apr 2020","2019","","","1671","1676","The future cyber society is a virtual world made of data, contrasted with the real world made of material. Human beings are already living in these two interacted and fusional worlds. Various of data are not only the kind of valuable resources, but also the new cognitions of methodology from the viewpoint of data. There are too many characteristics and attributions of data we even didn't really know, such as data philosophy, data thinking, data theory, data rules, data assets, data ownership, data protection, data sharing, data application, data method, data architecture, etc. We need to build an open, safety, sharable, ecological data platform to manage all kinds of data and support various applications for the future cyber society. A simple architecture of data-oriented and data ownership-based, constructed of one-body with two-wings for building complex information systems was proposed and it may be suitable for the future ordered cyber data society.","","978-1-7281-4034-6","10.1109/SmartWorld-UIC-ATC-SCALCOM-IOP-SCI.2019.00298","","https://ieeexplore.ieee.org/stamp/stamp.jsp?arnumber=9060237","Data-ism, data architecture, data ownership, data encryption, data registration, public key infrastructure, data security application","Big Data;Computers;Computer architecture;Internet;Collaboration","","5","","15","IEEE","9 Apr 2020","19-23 Aug. 2019","19-23 Aug. 2019","IEEE","IEEE Conferences"
"A Model for the Analytical Performance of Data Lake in Stock Market Analysis with Databricks Delta Lake","S. Kamalakkannan; A. Yasmin; A. R; P. Kavitha","Department of Information Technology, School of Computing Sciences, Vels Institute of Science, Technology & Advanced Studies, Pallavaram, Chennai, India; Department of Computer Science, JBAS College for women, Chennai, India; Faculty of Computing, Engineering and Science, University of South Wales, Treforest/Newport Campus, United Kingdom; Department of Computer Applications, School of Computing Sciences, Vels Institute of Science, Technology & Advanced Studies, Pallavaram, Chennai, India",2023 International Conference on Self Sustainable Artificial Intelligence Systems (ICSSAS),"6 Dec 2023","2023","","","1065","1071","Stock market investments are highly rewarding but also high in risk. Modern investors use variety of tools to take informed investment decisions. In the current era of digital world, financial service industry has generated huge volume and immense verities of data with extreme speed. Due to the rapid growth in data collection and the heterogeneous nature and complexity of the data, there is a need for Big Data analytical solution that would be able to deal with the stock market data. Large volumes of unstructured, heterogeneous raw data can be stored in a massively scalable manner using data lakes, which are the ideal solution to the big data storage conundrum. The ability of a data lake to preserve data in its original format while processing it at runtime using a schema on-read technique is its key feature. The challenge faced in the data lake is performing analytics which is a significant tool to calculate and analyze the stock market. The proposed architecture of Azure Databricks DeltaLake (ADDL) with Azure DataLake Storage Generation 2 (ADLSG2) is used for analytical processes like Fibonacci retracement for better stock analysis, which aid in forecasting the market price for better investment. As a result, the research focus is to produce a storage having read as well as write capabilities by taking into consideration the Extract-Load-Transform (ELT) operation on the datasource. In this experimental databricks implementation, runtime is performed using open source of Apache Spark API and a highly improved execution engine, which results in a significant performance improvement when comparing to the standard source of Apache Spark available on the ADLS platform. Additionally, the Fibonacci retracement level calculation is achieved with the analytics and forecasting of test close price with various ML and DL techniques such as KNN, LSTM are compared with original price of the test data for better prediction of forecast close price.","","979-8-3503-0085-7","10.1109/ICSSAS57918.2023.10331900","","https://ieeexplore.ieee.org/stamp/stamp.jsp?arnumber=10331900","Big data analytics;ADLSG2;Databricks Delta Lake;ELT;stock market;Fibonacci retracement;LSTM;Apache spark","Cloud computing;Runtime;Costs;Cluster computing;Lakes;Writing;Big Data applications","","1","","22","IEEE","6 Dec 2023","18-20 Oct. 2023","18-20 Oct. 2023","IEEE","IEEE Conferences"
"Toward a Big Data Architecture for Security Events Analytic","L. Fetjah; K. Benzidane; H. E. Alloussi; O. E. Warrak; S. Jai-Andaloussi; A. Sekkaki","Computer Science Department, Faculty of Sciences Ain Chock, Casablanca, Morocco; Computer Science Department, Faculty of Sciences Ain Chock, Casablanca, Morocco; Computer Science Department, Faculty of Sciences Ain Chock, Casablanca, Morocco; Computer Science Department, Faculty of Sciences Ain Chock, Casablanca, Morocco; Computer Science Department, Faculty of Sciences Ain Chock, Casablanca, Morocco; Computer Science Department, Faculty of Sciences Ain Chock, Casablanca, Morocco",2016 IEEE 3rd International Conference on Cyber Security and Cloud Computing (CSCloud),"18 Aug 2016","2016","","","190","197","Cloud Computing did come up with so many attractive advantages such as scalability, flexibility, accessibility, rapid application deployment, and user self service. However in hindsight, Cloud Computing makes ensuring security within these environments so much challenging. Therefore traditional security mechanisms such as firewalls and antivirus softwares have proven insufficient and incapable of dealing with the sheer amount of data and events generated within a Cloud infrastructure. Herein, we present a highly scalable module based system that relies upon Big Data techniques and tools providing a comprehensive solution to process and analyze relevant events (packets flow, logs files) in order to generate an informative decisions that will be handled accordingly and swiftly.","","978-1-5090-0946-6","10.1109/CSCloud.2016.53","","https://ieeexplore.ieee.org/stamp/stamp.jsp?arnumber=7545918","Cloud Computing;Security Information and Event Management (SIEM);Security Intelligence;Big Data;Hadoop;Spark;ITIL;SKMS","Security;Big data;Cloud computing;Sparks;Organizations;Context;Correlation","","7","","16","IEEE","18 Aug 2016","25-27 June 2016","25-27 June 2016","IEEE","IEEE Conferences"
"DataCockpit: A Toolkit for Data Lake Navigation and Monitoring Utilizing Quality and Usage Information","A. Narechania; S. Chakraborty; S. Agarwal; A. R. Sinha; R. A. Rossi; F. Du; J. Hoffswell; S. Guo; E. Koh; A. Endert; S. Navathe","Georgia Institute of Technology, Atlanta, USA; Georgia Institute of Technology, Atlanta, USA; Georgia Institute of Technology, Atlanta, USA; Adobe Research, Bengaluru, India; Adobe Research, San Jose, USA; Databricks, San Francisco, USA; Adobe Research, Seattle, USA; Adobe Research, San Jose, USA; Adobe Research, San Jose, USA; Georgia Institute of Technology, Atlanta, USA; Georgia Institute of Technology, Atlanta, USA",2023 IEEE International Conference on Big Data (BigData),"22 Jan 2024","2023","","","5305","5310","Modern organizations amass their datasets into centralized repositories called data lakes, affording analytics as needed. The resultant scale and complexity of these data lakes, however, can make data navigation and monitoring challenging for users. We present DataCockpit, a Python toolkit that leverages datasets, usage logs, and associated meta-data to provision data usage and quality characteristics. DataCockpit computes these characteristics for each attribute (e.g., number of times it was queried for subsequent use in downstream applications) and record (e.g., number of non-missing, valid values) and aggregates them at the level of datasets. We develop a visual monitoring tool, powered by DataCockpit, and demonstrate how it can assist data / system administrators as well as end-users to effectively navigate and monitor a data lake. DataCockpit and the monitoring tool are available as open source software for developers to build custom monitoring applications on top of data lakes.","","979-8-3503-2445-7","10.1109/BigData59044.2023.10386133","","https://ieeexplore.ieee.org/stamp/stamp.jsp?arnumber=10386133","data usage;data quality;monitoring;navigation;visualization;toolkit","Visualization;Navigation;Aggregates;Relational databases;Organizations;Big Data applications;Complexity theory","","1","","38","IEEE","22 Jan 2024","15-18 Dec. 2023","15-18 Dec. 2023","IEEE","IEEE Conferences"
"Policy-Based Access Control System for Delta Lake","Z. Chen; H. Shao; Y. Li; H. Lu; J. Jin","School of Software Engineering, Southeast University, Nanjing, Jiangsu, China; School of Computer Science and Engineering, Southeast University, Suzhou, Jiangsu, China; China Information Consulting & Designing Institute CO, LTD, Nanjing, Jiangsu, China; School of Information Engineering, Nanjing Audit University, Nanjing, Jiangsu, China; School of Computer Science and Engineering, Southeast University, Nanjing, Jiangsu, China",2022 Tenth International Conference on Advanced Cloud and Big Data (CBD),"25 Jan 2023","2022","","","60","65","Delta lake is a new generation of data storage solutions. It stores both transaction log and data files in one directory, and provides ACID transactions, scalable metadata handling, and unifies streaming and batch data processing on top of existing data lakes, such as S3, ADLS, GCS, and HDFS. Different from data warehouses, delta lakes allow data to be stored in the original format, retain complete data information, and provide efficient and low-cost storage solutions for data computing and analysis businesses. However, Since Delta Lake metadata is scattered in different resource files, the lack of a unified metadata view increases the difficulty of data governance. Also, Delta Lake adopts an open source storage system as the underlying storage, and its basic access control does not isolate different users, which may lead the risk of data leakage. At present, most common storage systems use data tables’ row and column fields for access control, while delta lake treats the file group as an object. In this paper, aiming at the difficulty of data governance, we design a data lake metadata management method to achieve unified and efficient management of metadata information in heterogeneous data. Then, we design a policy-based data lake access control mechanism, combined with the open source permission framework, and complete the access request for different users and roles in Delta Lake.","","979-8-3503-0971-3","10.1109/CBD58033.2022.00020","National Natural Science Foundation of China; Key Laboratory of Computer Network and Information Integration; Fundamental Research Funds for the Central Universities; ","https://ieeexplore.ieee.org/stamp/stamp.jsp?arnumber=10024547","Data Lake;Delta Lake;Metadata;Access Control","Access control;Memory;Lakes;Metadata;Lead;Data warehouses;Big Data applications","","3","","16","IEEE","25 Jan 2023","4-5 Nov. 2022","4-5 Nov. 2022","IEEE","IEEE Conferences"
"Data Lake Organization","F. Nargesian; K. Pu; B. Ghadiri-Bashardoost; E. Zhu; R. J. Miller","Department of Computer Science, University of Rochester, Rochester, NY, USA; Department of Computer Science, University of Ontario Institute of Technology, Oshawa, ON, Canada; Department of Computer Science, University of Toronto, Toronto, ON, Canada; Microsoft Research, Redmond, WA, USA; Khoury College of Computer Sciences, Northeastern University, Boston, MA, USA",IEEE Transactions on Knowledge and Data Engineering,"7 Dec 2022","2023","35","1","237","250","We consider the problem of building an organizational directory of data lakes to support effective user navigation. The organization directory is defined as an acyclic graph that contains nodes representing sets of attributes and edges indicating subset relationships between nodes. A probabilistic model is constructed to model user navigational behaviour. The model also predicts the likelihood of users finding relevant tables in a data lake given an organization. We formulate the data lake organization problem as an optimization over the organizational structure in order to maximize the expected likelihood of discovering tables by navigating. An approximation algorithm is proposed with an analysis of its error bound. The effectiveness and efficiency of the algorithm are evaluated on both synthetic and real data lakes. Our experiments show that our algorithm constructs organizations that outperform many existing organizations including an existing hand-curated taxonomy, a linkage graph, and a common baseline organization. We have also conducted a formal user study which shows that navigation can help users discover relevant tables that are not easily accessible by keyword search queries. This suggests that keyword search and navigation using an organization are complementary modalities for data discovery in data lakes.","1558-2191","","10.1109/TKDE.2021.3091101","NSERC Discovery(grant numbers:RGPIN-2017-05265); National Science Foundation(grant numbers:IIS-1956096,IIS-2107050); ","https://ieeexplore.ieee.org/stamp/stamp.jsp?arnumber=9693372","Data lake;dataset discovery;taxonomy;structure learning","Organizations;Big Data applications;Navigation;Lakes;Inspection;Taxonomy;Aquaculture","","5","","51","IEEE","25 Jan 2022","1 Jan. 2023","","IEEE","IEEE Journals"
"Simplify Big Data Analytics with Amazon EMR: A beginner’s guide to learning and implementing Amazon EMR for building data analytics solutions","S. Mishra",NA,Simplify Big Data Analytics with Amazon EMR: A beginner’s guide to learning and implementing Amazon EMR for building data analytics solutions,"","2022","","","","","Design scalable big data solutions using Hadoop, Spark, and AWS cloud native servicesKey FeaturesBuild data pipelines that require distributed processing capabilities on a large volume of dataDiscover the security features of EMR such as data protection and granular permission managementExplore best practices and optimization techniques for building data analytics solutions in Amazon EMRBook DescriptionAmazon EMR, formerly Amazon Elastic MapReduce, provides a managed Hadoop cluster in Amazon Web Services (AWS) that you can use to implement batch or streaming data pipelines. By gaining expertise in Amazon EMR, you can design and implement data analytics pipelines with persistent or transient EMR clusters in AWS. This book is a practical guide to Amazon EMR for building data pipelines. You'll start by understanding the Amazon EMR architecture, cluster nodes, features, and deployment options, along with their pricing. Next, the book covers the various big data applications that EMR supports. You'll then focus on the advanced configuration of EMR applications, hardware, networking, security, troubleshooting, logging, and the different SDKs and APIs it provides. Later chapters will show you how to implement common Amazon EMR use cases, including batch ETL with Spark, real-time streaming with Spark Streaming, and handling UPSERT in S3 Data Lake with Apache Hudi. Finally, you'll orchestrate your EMR jobs and strategize on-premises Hadoop cluster migration to EMR. In addition to this, you'll explore best practices and cost optimization techniques while implementing your data analytics pipeline in EMR. By the end of this book, you'll be able to build and deploy Hadoop- or Spark-based apps on Amazon EMR and also migrate your existing on-premises Hadoop workloads to AWS.What you will learnExplore Amazon EMR features, architecture, Hadoop interfaces, and EMR StudioConfigure, deploy, and orchestrate Hadoop or Spark jobs in productionImplement the security, data governance, and monitoring capabilities of EMRBuild applications for batch and real-time streaming data analytics solutionsPerform interactive development with a persistent EMR cluster and NotebookOrchestrate an EMR Spark job using AWS Step Functions and Apache AirflowWho this book is forThis book is for data engineers, data analysts, data scientists, and solution architects who are interested in building data analytics solutions with the Hadoop ecosystem services and Amazon EMR. Prior experience in either Python programming, Scala, or the Java programming language and a basic understanding of Hadoop and AWS will help you make the most out of this book.","","9781801077729","","","https://ieeexplore.ieee.org/xpl/ebooks/bookPdfWithBanner.jsp?fileName=10163079.pdf&bkn=10163079&pdfType=book","","","","","","","","27 Jun 2023","","","Packt Publishing","Packt Publishing eBooks"
"Tsdat: An Open-Source Data Standardization Framework for Marine Energy and Beyond","C. Lansing; M. Levin; C. Sivaraman; R. Fao; F. Driscoll","Advanced Computing, Mathematics, and Data Division Pacific Northwest National Laboratory, Richland, U.S.A.; Advanced Computing, Mathematics, and Data Division Pacific Northwest National Laboratory, Richland, U.S.A.; Advanced Computing, Mathematics, and Data Division Pacific Northwest National Laboratory, Richland, U.S.A.; Water Power, Energy Conversion & Storage Systems National Renewable Energy Laboratory, Golden, U.S.A.; Water Power, Energy Conversion & Storage Systems National Renewable Energy Laboratory, Golden, U.S.A.",OCEANS 2021: San Diego – Porto,"15 Feb 2022","2021","","","1","6","Many organizations are tasked with the collection and processing of large quantities of data from various measurement devices. Data reported from these sources are often not interoperable with datasets and software used by analysts and other organizations in the same domain, introducing barriers for collaboration on large-scale projects. This poses a particular problem for cross-device comparisons and machine learning applications, which rely on large quantities of data from multiple sources. To address these challenges, the open-source Time-Series Data Pipelines (Tsdat) Python framework was developed by Pacific Northwest National Laboratory, with strategic guidance and direction provided by the National Renewable Energy Laboratory and Sandia National Laboratories to facilitate collaboration and accelerate advancements in the marine energy domain through the development of an open-source ecosystem of tools. This paper will describe the Tsdat framework and the data standards within which it operates. A beta version of Tsdat has been released and is being used by several projects in marine energy, wind energy, and building energy systems.","0197-7385","978-0-692-93559-0","10.23919/OCEANS44145.2021.9706101","","https://ieeexplore.ieee.org/stamp/stamp.jsp?arnumber=9706101","Python;open-source;data standards;data lake;big data;interoperability","Wind energy;Instruments;Standards organizations;Buildings;Collaboration;Organizations;Task analysis","","1","","23","","15 Feb 2022","20-23 Sept. 2021","20-23 Sept. 2021","IEEE","IEEE Conferences"
"CRISIS: Integrating AIS and Ocean Data Streams Using Semantic Web Standards for Event Detection","A. Soares; R. Dividino; F. Abreu; M. Brousseau; A. W. Isenor; S. Webb; S. Matwin","Institute for Big Data Analytics, Halifax, Nova Scotia; Institute for Big Data Analytics, Halifax, Nova Scotia; Institute for Big Data Analytics, Halifax, Nova Scotia; Institute for Big Data Analytics, Halifax, Nova Scotia; Defence Research and Development Canada (DRDC), Halifax, Nova Scotia; Defence Research and Development Canada (DRDC), Halifax, Nova Scotia; Institute for Big Data Analytics, Halifax, Nova Scotia",2019 International Conference on Military Communications and Information Systems (ICMCIS),"19 Sep 2019","2019","","","1","7","Information deluge is still an issue in the maritime environment, creating situations where data are sometimes underutilized or in more extreme cases, not utilized, in the decision-making process. In part, this is due to the high volume of incoming data that are available to the operational community. However, better exploitation of these data streams can be accomplished through techniques that focus on the semantics of the incoming stream, to discover information-based alerts that generate knowledge that is only obtainable when considering the totality of the streams. In this paper, we present an agile data architecture for real-time data representation, integration, and querying situations over heterogeneous data streams using Semantic Web Technologies, with the goal of improved knowledge interoperability. We apply the framework to the maritime ship traffic domain to discover real-time traffic alerts by querying and reasoning across multiple streams.","","978-1-5386-9383-4","10.1109/ICMCIS.2019.8842749","","https://ieeexplore.ieee.org/stamp/stamp.jsp?arnumber=8842749","","Marine vehicles;Semantics;Real-time systems;Ontologies;Standards;Resource description framework","","22","","26","Crown","19 Sep 2019","14-15 May 2019","14-15 May 2019","IEEE","IEEE Conferences"
"Hybrid big data architecture for high-speed log anomaly detection","P. Tangsatjatham; N. Nupairoj","Department of Computer Engineering, Chulalongkorn University, Bangkok, Thailand; Department of Computer Engineering, Chulalongkorn University, Bangkok, Thailand",2016 13th International Joint Conference on Computer Science and Software Engineering (JCSSE),"21 Nov 2016","2016","","","1","6","Log processing can be very challenging, especially for environments with lots of servers. In these environments, log data is large, coming at high-speed, and have various formats, the classic case of big data problem. This makes anomaly detection very difficult due to the fact that to get good accuracy, large amount of data must be processed in real-time. To solve this problem, this paper proposes a hybrid architecture for log anomaly detection using Apache Spark for data processing and Apache Flume for data collecting. To demonstrate the capabilities of our proposed solution, we implement a SARIMA-based anomaly detection as a case study. The experimental results clearly indicated that our proposed architecture can support log processing in large-scale environment effectively.","","978-1-5090-2033-1","10.1109/JCSSE.2016.7748933","","https://ieeexplore.ieee.org/stamp/stamp.jsp?arnumber=7748933","Hadoop;Real-Time;Log Processing;Largs-Scale;Hybrid Processing","Computer architecture;Sparks;Real-time systems;Bandwidth;Servers;Data processing;Predictive models","","3","","16","IEEE","21 Nov 2016","13-15 July 2016","13-15 July 2016","IEEE","IEEE Conferences"
