"Artificial Intelligence in Finance: Coffee Commodity Trading Big Data for Informed Decision Making","N. -B. -v. Le; Y. -S. Seo; J. -H. Huh","Department of Data Informatics, National Korea Maritime and Ocean University, Busan, Republic of Korea; School of Computer Science and Engineering, Yeungnam University, Gyeongsan, Republic of Korea; Interdisciplinary Major of Ocean Renewable Energy Engineering, National Korea Maritime and Ocean University, Busan, Republic of Korea",IEEE Access,"10 Jul 2024","2024","12","","91780","91792","Coffee, the second-largest global soft commodity, can take advantage of a comprehensive mining of daily and historical market data for more effective informed trading decisions. Advanced ICT and data mining technologies can change the trading market operation. The existing systems are confronted with certain constraints, including incomplete data, insufficient documentation for storage, and a requirement for a scalable infrastructure for big data analytics, such as a data warehouse or data lakehouse. To address this issue, the paper presents a design and implementation of a coffee commodity trading big data warehouse capable of analyzing various essential parameters for supporting informed decision-making. First, the designed system can automatically collect coffee trading data for New York Arabica coffee futures prices from selected worldwide reports and financial data portals. Next, the Extract, transform, and load (ETL) process is adopted to ingest coffee futures trading crawled data into the 3 layers data warehouse. Finally, the analytical system will extract and visualize selected key dimensions that influence coffee futures prices within different observation windows and perspectives. As a result, we implement a prototype of a coffee trading data warehouse on the crawled data from January 2000 to October 2022 and visualize trends in coffee futures prices based on the collected data for informed decision-making. The construction system is capable of stably operating and processing large volumes of transaction data. This paper will be valuable documentation for reference and decision support for coffee commodity trading enterprises and contribute to the development of future forecasting algorithms.","2169-3536","","10.1109/ACCESS.2024.3409762","National Research Foundation of Korea (NRF); Korea Government (MSIT)(grant numbers:NRF-2023R1A2C1008134); ","https://ieeexplore.ieee.org/stamp/stamp.jsp?arnumber=10549867","Coffee big data;data warehouse;coffee commodity trading;ETL process;informed decision-making;data visualization;big data","Data warehouses;Contracts;Data visualization;Predictive models;Data models;Data mining;Big Data;Market research;Pricing;Stock markets;Financial services","","6","","40","CCBYNCND","5 Jun 2024","2024","","IEEE","IEEE Journals"
"Data Engineering with AWS: Learn how to design and build cloud-based data transformation pipelines using AWS","G. Eagar",NA,Data Engineering with AWS: Learn how to design and build cloud-based data transformation pipelines using AWS,"","2021","","","","","The missing expert-led manual for the AWS ecosystem — go from foundations to building data engineering pipelines effortlessly Purchase of the print or Kindle book includes a free eBook in the PDF format.Key FeaturesLearn about common data architectures and modern approaches to generating value from big dataExplore AWS tools for ingesting, transforming, and consuming data, and for orchestrating pipelinesLearn how to architect and implement data lakes and data lakehouses for big data analytics from a data lakes expertBook DescriptionWritten by a Senior Data Architect with over twenty-five years of experience in the business, Data Engineering for AWS is a book whose sole aim is to make you proficient in using the AWS ecosystem. Using a thorough and hands-on approach to data, this book will give aspiring and new data engineers a solid theoretical and practical foundation to succeed with AWS. As you progress, you’ll be taken through the services and the skills you need to architect and implement data pipelines on AWS. You'll begin by reviewing important data engineering concepts and some of the core AWS services that form a part of the data engineer's toolkit. You'll then architect a data pipeline, review raw data sources, transform the data, and learn how the transformed data is used by various data consumers. You’ll also learn about populating data marts and data warehouses along with how a data lakehouse fits into the picture. Later, you'll be introduced to AWS tools for analyzing data, including those for ad-hoc SQL queries and creating visualizations. In the final chapters, you'll understand how the power of machine learning and artificial intelligence can be used to draw new insights from data. By the end of this AWS book, you'll be able to carry out data engineering tasks and implement a data pipeline on AWS independently.What you will learnUnderstand data engineering concepts and emerging technologiesIngest streaming data with Amazon Kinesis Data FirehoseOptimize, denormalize, and join datasets with AWS Glue StudioUse Amazon S3 events to trigger a Lambda process to transform a fileRun complex SQL queries on data lake data using Amazon AthenaLoad data into a Redshift data warehouse and run queriesCreate a visualization of your data using Amazon QuickSightExtract sentiment data from a dataset using Amazon ComprehendWho this book is forThis book is for data engineers, data analysts, and data architects who are new to AWS and looking to extend their skills to the AWS cloud. Anyone new to data engineering who wants to learn about the foundational concepts while gaining practical experience with common data engineering services on AWS will also find this book useful. A basic understanding of big data-related topics and Python coding will help you get the most out of this book but it’s not a prerequisite. Familiarity with the AWS console and core services will also help you follow along.","","9781800569041","","","https://ieeexplore.ieee.org/xpl/ebooks/bookPdfWithBanner.jsp?fileName=10162399.pdf&bkn=10162399&pdfType=book","","","","","","","","27 Jun 2023","","","Packt Publishing","Packt Publishing eBooks"
"DLAQP: A Data Lake-Based Healthcare Approximate Query Processing Framework","J. Guo; T. Liu; K. Wen; C. Xia; K. Chao; J. Li","Software Engineering College, Henan University, Kaifeng, China; Software Engineering College, Henan University, Kaifeng, China; Software Engineering College, Henan University, Kaifeng, China; Kaifeng 155 Hospital, Kaifeng, China; Software Engineering College, Henan University, Kaifeng, China; Software Engineering College, Henan University, Kaifeng, China",2025 6th International Conference on Computer Vision and Data Mining (ICCVDM),"18 Dec 2025","2025","","","407","413","Efficient exploration of healthcare data is essential for clinical research and data-driven medical decision-making. However, traditional exact query methods often fall short in handling large-scale, complex medical datasets due to performance limitations. Approximate Query Processing (AQP), which improves efficiency by tolerating a bounded error, has shown great promise in this context. Yet, existing AQP techniques often fail to deliver satisfactory accuracy on medical data, largely due to challenges such as skewed distributions and weak attribute correlations that undermine the effectiveness of generalpurpose sampling. To address these issues, we propose DLAQP, a datalake-based approximate query processing system tailored for healthcare data. It employs adaptive sampling to improve sample representativeness and leverages a Variational Autoencoder (VAE) to generate high-quality samples. Experimental results show that, compared to traditional methods, DLAQP reduces query error by an average of 60% while maintaining comparable query latency. The system has been validated on real-world medical datasets, further demonstrating its effectiveness and practical value in actual healthcare data analysis scenarios.","","979-8-3315-6621-0","10.1109/ICCVDM66874.2025.11290516","","https://ieeexplore.ieee.org/stamp/stamp.jsp?arnumber=11290516","Approximate Query Processing;Conditional variational auto-encoder;machine learning;Aggregate Query","Computer vision;Data analysis;Correlation;Query processing;Aggregates;Decision making;Autoencoders;Medical services;Machine learning;Data mining","","","","18","IEEE","18 Dec 2025","12-14 Sept. 2025","12-14 Sept. 2025","IEEE","IEEE Conferences"
"Characterising IoT for Smart development: Anaylsing the challenges","S. Malhotra; V. Agarwal; M. Anjum; A. Parashar","Fortune Institute of International Business, New-Delhi, India; Amity International Business School, Amity University Uttar Pradesh, Noida, India; Amity Institute of Information Technology, Amity University Uttar Pradesh, Noida, India; Amity International Business School, Amity University Uttar Pradesh, Noida, India",2023 3rd International Conference on Innovative Practices in Technology and Management (ICIPTM),"10 May 2023","2023","","","1","5","Industry 4.0 is all about putting industrial data from multiple sources into a data lake and then using analytics, artificial intelligence, machine learning to utilize the data for businesses. The primary reason for that is the advent of the Internet of Things (IoT). IoT has enabled uninterrupted sharing and exchange of data for its users from the consumer to the industrial level. Although still in the nascent stage of evolution, IoT has the potential to significantly impact business outcomes and will be instrumental in bringing a transformation in the way we communicate and exchange information. However, there remains a considerable gap in identifying the challenges in the implementation of IoT platforms and techniques. This paper aims at presenting a comprehensive analysis of the major challenges in the implementation of IoT and classifies them into two broad categories-technological and managerial according to the opinions of the experts. An attempt has been made herein to create a hierarchy depicting the key challenges where the researchers and industry should focus their attention and make better strategic decisions. A multi-criteria decision-making method known as the Best-Worst Method (BWM) has been used to rate the challenges. Results show that power requirement is the major challenge in technological challenges and maintenance is the major challenge in managerial challenges.","","979-8-3503-3623-8","10.1109/ICIPTM57143.2023.10118284","","https://ieeexplore.ieee.org/stamp/stamp.jsp?arnumber=10118284","IoT;Internet of Things;Challenges in Implementation;Best-Worst Method","Industries;Protocols;Biological system modeling;Mashups;Energy resolution;Standardization;Maintenance engineering;Internet of Things;Smart devices;Business","","1","","13","IEEE","10 May 2023","22-24 Feb. 2023","22-24 Feb. 2023","IEEE","IEEE Conferences"
"Data-Driven Transformation in Investment Banks","B. Iraqi; L. Benhiba; M. A. Janati Idrissi","ENSIAS Mohammed V University in Rabat, Rabat, Morocco; ENSIAS Mohammed V University in Rabat, Rabat, Morocco; ENSIAS Mohammed V University in Rabat, Rabat, Morocco",2023 IEEE 6th International Conference on Cloud Computing and Artificial Intelligence: Technologies and Applications (CloudTech),"29 Dec 2023","2023","","","01","09","Digital transformation has become a major concern to all companies, and with data being at the center of this transformation, enterprises are increasingly shifting to a data-driven transformation where decision-making is based on facts and data. In sectors where data has always been in the center of all work processes, such as investment banking, data-driven transformation has even more importance as it allows a more tangible result generation. This paper aims to provide guidance to investment banks on their data-driven transformation journey by providing insights on the target culture, the patterns that could be adopted and phases that should be followed to roadmap this transformation. The paper also discusses when data architecture work starts, its drivers, challenges and risks to mitigate in order to ensure the highest performance levels possible. The objective is to getbetter sense of all dimensions to inspire investment banks to engage in this process.","","979-8-3503-0306-3","10.1109/CloudTech58737.2023.10366132","","https://ieeexplore.ieee.org/stamp/stamp.jsp?arnumber=10366132","investment banking;data analytics;data-driven transformation;data-driven enterprise;data architecture","Cloud computing;Data analysis;Digital transformation;Decision making;Computer architecture;Companies;Banking","","1","","19","IEEE","29 Dec 2023","21-23 Nov. 2023","21-23 Nov. 2023","IEEE","IEEE Conferences"
"A Comprehensive Survey on Advanced Data Science Platforms for Cyber-Physical Systems, Digital Twins, and Robotics","R. Kabir; Y. Watanobe; D. Ding; M. Rashedul Islam; K. Naruse","School of Computer Science and Engineering, The University of Aizu, Aizuwakamatsu, Fukushima, Japan; School of Computer Science and Engineering, The University of Aizu, Aizuwakamatsu, Fukushima, Japan; School of Computer Science and Engineering, The University of Aizu, Aizuwakamatsu, Fukushima, Japan; Department of Computer Science and Engineering, University of Asia Pacific, Dhaka, Bangladesh; School of Computer Science and Engineering, The University of Aizu, Aizuwakamatsu, Fukushima, Japan",IEEE Access,"22 Oct 2025","2025","13","","177269","177304","The integration of Cyber-Physical Systems (CPS), Digital Twins (DT), and robotics with Advanced Data Science Platforms (ADSP) is rapidly transforming industrial and research landscapes by enabling real-time data processing, intelligent decision-making, and enhanced automation. Over the past decades, with the growing demand for adaptable, expandable, and secure platforms, numerous groundbreaking studies have emerged in the field of ADSP for CPS, DT, and robotics. However, most existing research addresses isolated aspects of AI, CPS, DTs, or robotics, lacking a holistic view of how ADSP expands and optimizes these technologies. To address this gap, this survey provides a comprehensive and structured review of the existing methodologies, tools, and techniques at each step of the ADSP workflow, focusing on their applications in CPS, DT, and robotics. Firstly, this survey analyzes the data ingestion phase, focusing on raw data collection architecture, advanced data pre-processing techniques, and data lake integration, while identifying integration and scalability challenges. Secondly, the development methodologies and data analysis techniques within experimental workflows are explored by highlighting widely used tools and real-world case studies. Thirdly, a detailed overview of optimization techniques and deployment strategies is presented, including cloud, edge, and hybrid models, supported by practical deployment examples. Finally, the continuous learning mechanisms are investigated for adaptive system updates, challenges in real-time adaptation, and expanding model performance. Additionally, this survey focuses on evaluation metrics, benchmark studies, and performance comparisons to assess platform efficiency across various domains. This study also explores emerging challenges such as data quality & availability, platform expandability, model transparency, and security, offering insights into future research directions. To ensure the rigor and breadth, this survey is conducted on 316 high-quality studies, state-of-the-art methodologies, and platforms that are selected using the PRISMA methodology from over 600 reviewed publications. By presenting a structured overview of ADSPs, this work aims to serve as a valuable resource for researchers, engineers, and industry professionals aiming to utilize data science for innovation in CPS, DT, and robotics.","2169-3536","","10.1109/ACCESS.2025.3619776","Commissioned Research Fund provided by Fukushima Institute for Research, Education, and Innovation (F-REI)(grant numbers:JPFR24010102); ","https://ieeexplore.ieee.org/stamp/stamp.jsp?arnumber=11197470","Cyber-physical systems (CPS);digital twins (DT);robotics;advanced data science platforms (ADSP);machine learning (ML);deep learning (DL);artificial intelligence (AI);edge computing;cloud computing;Internet of Things (IoT);real-time data processing;automation;security and privacy;decision-making systems;benchmarking;data-driven optimization;reinforcement learning (RL);performance evaluation;smart manufacturing;industrial automation","Service robots;Real-time systems;Data models;Surveys;Adaptation models;Optimization;Security;Data science;Benchmark testing;Technological innovation","","","","316","CCBY","9 Oct 2025","2025","","IEEE","IEEE Journals"
"The Role of Data Catalog in Advancing Data Monetization Strategy","S. Rosandić",Ericsson Nikola Tesla d.d.,2025 MIPRO 48th ICT and Electronics Convention,"2 Sep 2025","2025","","","1164","1169","For future-oriented organizations, data are a vital asset and key to digital transformation. Still, few truly regard data as a strategic asset using their full potential and creating financial value. In real cases, data are often scattered across systems creating silos that hinder coordination, accessibility, and enterprise data modeling. With data continuously growing, finding the right information at the right time becomes challenging. Information is trapped in specific departments or systems and inconsistent definitions and business knowledge further complicate processes. It is essential, therefore, to understand and align business and data architecture to unlock monetization.","1847-3938","979-8-3315-3597-1","10.1109/MIPRO65660.2025.11131961","","https://ieeexplore.ieee.org/stamp/stamp.jsp?arnumber=11131961","data strategy;data governance;data architecture;data ecosystem;data catalog;metadata;data monetization;data marketplace;situation awareness;single source of truth","Costs;Costing;Digital transformation;Ecosystems;Decision making;Organizations;Metadata;Data governance;Artificial intelligence;Consumer electronics","","","","28","IEEE","2 Sep 2025","2-6 June 2025","2-6 June 2025","IEEE","IEEE Conferences"
"A Two-Stage Method for Ultra-Short-Term PV Power Forecasting Based on Data-Driven","H. Zhou; J. Wang; F. Ouyang; C. Cui; X. Li","Laboratory of Big Data and Artificial Intelligence, College of Information and Engineering, China Jiliang University, Hangzhou, China; Laboratory of Big Data and Artificial Intelligence, College of Information and Engineering, China Jiliang University, Hangzhou, China; Laboratory of Big Data and Artificial Intelligence, College of Information and Engineering, China Jiliang University, Hangzhou, China; Key Laboratory of Public Security Information Application Based on Big Data Architecture, Zhejiang Police College, Hangzhou, China; Laboratory of Big Data and Artificial Intelligence, College of Information and Engineering, China Jiliang University, Hangzhou, China",IEEE Access,"1 May 2023","2023","11","","41175","41189","To promote the real-time dispatching of a power grid and balanced decision-making of power producers, accuracy and real-time forecasting are two main problems that need to be solved in ultra-short-term photovoltaic (PV) forecasting. Focusing on the problems of slow model training speed and low forecasting accuracy due to the redundancy of training data samples and insufficient long periodic capture of data in complex weather, this paper proposes a two-stage method for ultra-short-term PV power forecasting based on data-driven. In the meteorological analysis stage, the generation power samples similar to the forecast day were extracted by inputting daily meteorological features and using maximal information coefficient (MIC) weighted grey correlation degree to form the corresponding forecast data set. In the power forecasting stage, the temporal convolutional used network (TCN) extracts local features to maintain the sequence of extracted features. Then the bidirectional gating unit (BiGRU) combined with the Skip connection strategy was used to fully learn the long and the short time sequence of photovoltaic sequences, and the attention mechanism was used to pay adaptive attention to the more important historical states. This study experimented on the measured data from a photovoltaic power station in Southeastern China. The experimental results show that this method is effective in photovoltaic power short-term forecasts. In addition, compared with the latest model, this method has smaller forecasting errors and higher robustness in the time scales of 15 minutes, 30 minutes, 45 minutes, and 60 minutes. Specifically, indicator R2 increased by an average of 5.4%, while indicators RMSE and MAE decreased by 8.6% and 7.3%, respectively.","2169-3536","","10.1109/ACCESS.2023.3267515","Zhejiang Province Public Welfare Technology Application Research Project(grant numbers:LGG22E070003); Ministry of Public Security Open Subjects of the Key Laboratory of Public Security Information Application Based on Big Data Architecture(grant numbers:2021DSJSYS004); ","https://ieeexplore.ieee.org/stamp/stamp.jsp?arnumber=10103522","Bidirectional gating unit;temporal convolutional network;maximal information coefficient;skip connection;photovoltaic power forecasting","Forecasting;Feature extraction;Predictive models;Photovoltaic systems;Training;Time series analysis;Correlation","","17","","36","CCBYNCND","17 Apr 2023","2023","","IEEE","IEEE Journals"
"Blockchain Technologies for Chain of Custody Authentication","K. Chandramouli; R. Horincar; C. J. Naurois; D. Pallmer; D. Faure; W. M&#xfc;ller; K. Demestichas","Multimedia and Vision Research Group, School of Electronic Engineering and Computer Science, Venaka Media Limited,Queen Mary University of London, London,London, UK,UK; Thales, Courbevoie, France; Thales, Courbevoie, France; Fraunhofer IOSB, Karlsruhe, Germany; Thales, Courbevoie, France; Fraunhofer IOSB, Karlsruhe, Germany; Institute of Communication and Computer Systems, National Technical University of Athens, Athens, Greece",Security Technologies and Social Implications,"","2023","","","262","289","Technological advances are rapidly and radically changing human society, with “smart” sensors and gadgets penetrating almost all facets of daily life. The mass availability of these technologies has resulted in an exponential increase in the quantity of generated data. Together with the simultaneous exponential growth in computing power, this has driven rapid advances in the application of machine learning (ML) and artificial intelligence (AI). These developments in the fields of data availability and AI technologies present even greater challenges for law enforcement and policing, while simultaneously opening huge opportunities. Complementing the benefits of these technologies by the law enforcement authorities, criminals are also equally exploiting technology. A part of the digital world is the increasing abundance of digital evidence; from CCTV footage to emails to phone records, evidence has now gone digital and there is a requirement to ensure it is accessible, readable, and has long‐term integrity when current technology, systems, or formats have been replaced or decommissioned. There is a further requirement for a seamless interface between policing and the criminal justice system to ensure digital evidence can be presented easily and without delay. As the quantity of data being used in criminal investigations becomes increasing larger, there is a critical need to maintain records tracing the origin and processing of evidence collected in digital format to authenticate the validity of the evidence. Addressing this need, the multimedia analysis and correlation engine for organized crime prevention and investigation (MAGNETO) project proposed the use of blockchain technologies for tracking and recording the processing of information within the big‐data architecture of the criminal investigation platform. The novelty of the proposed framework relies on the use of semantic technologies for knowledge formalization and the use of immutable technology based on hashing solutions to prevent evidentiary modifications. The platform addresses the need for mitigating the impact of cognitive bias to ensure the investigation platform offers objectivity in processing evidence.","","9781119834151","10.1002/9781119834175.ch11","","https://ieeexplore.ieee.org/xpl/ebooks/bookPdfWithBanner.jsp?fileName=9930735.pdf&bkn=9928039&pdfType=chapter","","Magnetic recording;Europe;Magnetic resonance imaging;Law;Soft sensors;Semantics;Blockchains","","","","","","26 Oct 2022","","","IEEE","Wiley-IEEE Press eBook Chapters"
